{
  "$schema": "http://json-schema.org/draft-07/schema#",
  "$id": "https://hexblot.github.io/composer-remediate/schema/report.schema.json",
  "title": "Composer Remediate report",
  "description": "Machine-readable output of `composer remediate --format=json` (schema_version 1).",
  "type": "object",
  "required": ["schema_version", "analysis_metadata", "exit_code", "warnings", "summary", "findings", "unsolved_findings"],
  "additionalProperties": false,
  "properties": {
    "schema_version": {"type": "integer", "const": 1},
    "analysis_metadata": {
      "type": "object",
      "description": "Reproducibility metadata: project path, engine/Composer/PHP versions, advisory source, solver, sha256 of composer.json and composer.lock, timestamp, locked package count.",
      "additionalProperties": {"type": "string"}
    },
    "exit_code": {"type": "integer", "minimum": 0, "maximum": 5},
    "warnings": {"type": "array", "items": {"type": "string"}},
    "summary": {
      "type": "object",
      "required": ["advisories", "packages", "packages_with_fix", "fail_on", "packages_gated", "combined_command", "combined_fixes", "combined_total", "combined_fixes_all", "combined_changes"],
      "additionalProperties": false,
      "properties": {
        "advisories": {"type": "integer", "minimum": 0},
        "packages": {"type": "integer", "minimum": 0},
        "packages_with_fix": {"type": "integer", "minimum": 0},
        "fail_on": {"type": ["string", "null"], "enum": ["low", "medium", "moderate", "high", "critical", null], "description": "Severity threshold given with --fail-on, if any"},
        "packages_gated": {"type": "integer", "minimum": 0, "description": "Packages whose findings count towards the exit code under the threshold"},
        "combined_command": {"type": ["string", "null"]},
        "combined_fixes": {"type": ["integer", "null"]},
        "combined_total": {"type": ["integer", "null"]},
        "combined_fixes_all": {"type": ["boolean", "null"]},
        "combined_changes": {"oneOf": [{"$ref": "#/definitions/changeSummary"}, {"type": "null"}]}
      }
    },
    "findings": {"type": "array", "items": {"$ref": "#/definitions/finding"}},
    "unsolved_findings": {"type": "array", "items": {"type": "string"}, "description": "Package names without a verified remediation."}
  },
  "definitions": {
    "changeSummary": {
      "type": "object",
      "required": ["changed", "added", "removed", "total", "major_change", "downgrade", "prerelease"],
      "additionalProperties": false,
      "properties": {
        "changed": {"type": "integer", "minimum": 0},
        "added": {"type": "integer", "minimum": 0},
        "removed": {"type": "integer", "minimum": 0},
        "total": {"type": "integer", "minimum": 0},
        "major_change": {"type": "boolean"},
        "downgrade": {"type": "boolean"},
        "prerelease": {"type": "boolean"}
      }
    },
    "change": {
      "type": "object",
      "required": ["package", "kind", "step", "from", "to"],
      "additionalProperties": false,
      "properties": {
        "package": {"type": "string"},
        "kind": {"type": "string", "enum": ["added", "removed", "upgraded", "downgraded", "changed"]},
        "step": {"type": ["string", "null"], "enum": ["major", "minor", "patch", "other", null]},
        "from": {"type": ["string", "null"]},
        "to": {"type": ["string", "null"]}
      }
    },
    "strategy": {"type": "string", "enum": ["lock-refresh", "with-dependencies", "parent-update", "root-constraint-widen", "direct-require"]},
    "advisory": {
      "type": "object",
      "required": ["id", "cve", "title", "link", "severity", "reported_at", "affected_versions", "sources"],
      "additionalProperties": false,
      "properties": {
        "id": {"type": "string"},
        "cve": {"type": ["string", "null"]},
        "title": {"type": ["string", "null"]},
        "link": {"type": ["string", "null"]},
        "severity": {"type": ["string", "null"]},
        "reported_at": {"type": ["string", "null"], "description": "RFC 3339"},
        "affected_versions": {"type": "string", "description": "Composer constraint expression"},
        "sources": {"type": "array", "items": {"type": "object", "required": ["name", "remoteId"], "properties": {"name": {"type": "string"}, "remoteId": {"type": "string"}}}}
      }
    },
    "pathSegment": {
      "type": "object",
      "required": ["package", "version", "requires"],
      "additionalProperties": false,
      "properties": {
        "package": {"type": "string", "description": "\"root\" for the root package"},
        "version": {"type": ["string", "null"]},
        "requires": {"type": "string", "description": "The constraint this package places on the next element of the chain"}
      }
    },
    "path": {
      "type": "object",
      "required": ["cyclic", "chain", "target"],
      "additionalProperties": false,
      "properties": {
        "cyclic": {"type": "boolean"},
        "chain": {"type": "array", "items": {"$ref": "#/definitions/pathSegment"}, "description": "From the root package down to the package requiring the vulnerable one"},
        "target": {"type": "object", "required": ["package", "version"], "properties": {"package": {"type": "string"}, "version": {"type": "string"}}}
      }
    },
    "rootConstraintChange": {
      "type": "object",
      "required": ["package", "from", "to", "dev"],
      "additionalProperties": false,
      "properties": {
        "package": {"type": "string"},
        "from": {"type": ["string", "null"]},
        "to": {"type": "string"},
        "dev": {"type": "boolean"}
      }
    },
    "remediation": {
      "oneOf": [
        {
          "type": "object",
          "required": ["status", "blocker"],
          "additionalProperties": false,
          "properties": {
            "status": {"const": "none"},
            "blocker": {"type": ["string", "null"]}
          }
        },
        {
          "type": "object",
          "required": ["status", "command", "strategy", "root_constraint_changes", "summary", "changes"],
          "additionalProperties": false,
          "properties": {
            "status": {"const": "verified"},
            "command": {"type": "string"},
            "strategy": {"$ref": "#/definitions/strategy"},
            "root_constraint_changes": {"type": "array", "items": {"$ref": "#/definitions/rootConstraintChange"}},
            "summary": {"oneOf": [{"$ref": "#/definitions/changeSummary"}, {"type": "null"}]},
            "changes": {"type": "array", "items": {"$ref": "#/definitions/change"}}
          }
        }
      ]
    },
    "candidate": {
      "type": "object",
      "required": ["command", "strategy", "outcome"],
      "additionalProperties": false,
      "properties": {
        "command": {"type": "string"},
        "strategy": {"$ref": "#/definitions/strategy"},
        "outcome": {"type": "string", "enum": ["valid", "rejected", "skipped"]},
        "rank": {"type": "integer", "minimum": 1},
        "reason": {"type": "string"},
        "summary": {"$ref": "#/definitions/changeSummary"},
        "solver_status": {"type": "string", "enum": ["resolved", "conflict", "transport-error", "error"]}
      }
    },
    "finding": {
      "type": "object",
      "required": ["package", "version", "version_normalized", "direct", "dev", "via_replaced_package", "advisories", "paths_total", "paths", "remediation", "candidates"],
      "additionalProperties": false,
      "properties": {
        "package": {"type": "string"},
        "version": {"type": "string"},
        "version_normalized": {"type": "string"},
        "direct": {"type": "boolean"},
        "dev": {"type": "boolean"},
        "via_replaced_package": {"type": ["string", "null"]},
        "advisories": {"type": "array", "minItems": 1, "items": {"$ref": "#/definitions/advisory"}},
        "paths_total": {"type": "integer", "minimum": 0},
        "paths": {"type": "array", "maxItems": 10, "items": {"$ref": "#/definitions/path"}},
        "remediation": {"$ref": "#/definitions/remediation"},
        "candidates": {"type": "array", "items": {"$ref": "#/definitions/candidate"}}
      }
    }
  }
}
