{
    "schema_version": 1,
    "analysis_metadata": {
        "project": "invoiceninja-phpjwt-two-level",
        "engine_version": "dev-main",
        "composer_version": "(fixture)",
        "php_version": "(fixture)",
        "advisory_source": "advisory snapshot advisories.json",
        "solver": "in-process Composer dry-run",
        "composer_json_sha256": "fe3d6f577ed6358320f6f6b24500fc82ce71c7bd95f2d668398c28a9661cf249",
        "composer_lock_sha256": "2dbaa7b34c4c01d7ef5715f78a6c4dfe11a0a4533a4b8855f22eb8d218f54b2f",
        "analysis_timestamp": "(fixture)",
        "locked_packages": "217"
    },
    "exit_code": 2,
    "warnings": [],
    "summary": {
        "advisories": 3,
        "packages": 2,
        "packages_with_fix": 1,
        "fail_on": null,
        "packages_gated": 2,
        "combined_command": "composer update google/apiclient:v2.12.2 -W -m --with 'firebase/php-jwt:>=6.0.0'",
        "combined_fixes": 1,
        "combined_total": 3,
        "combined_fixes_all": false,
        "combined_changes": {
            "changed": 3,
            "added": 0,
            "removed": 0,
            "total": 3,
            "major_change": true,
            "downgrade": false,
            "prerelease": false
        }
    },
    "findings": [
        {
            "package": "firebase/php-jwt",
            "version": "v5.5.1",
            "version_normalized": "5.5.1.0",
            "direct": false,
            "dev": false,
            "via_replaced_package": null,
            "advisories": [
                {
                    "id": "PKSA-2kqm-ps5x-s4f5",
                    "cve": "CVE-2021-46743",
                    "title": "Key/algorithm type confusion",
                    "link": "https://github.com/advisories/GHSA-8xf4-w7qw-pjjw",
                    "severity": "critical",
                    "reported_at": "2022-03-30T00:00:00+00:00",
                    "affected_versions": "<6.0.0",
                    "sources": [
                        {
                            "name": "FriendsOfPHP/security-advisories",
                            "remoteId": "firebase/php-jwt/CVE-2021-46743.yaml"
                        },
                        {
                            "name": "GitHub",
                            "remoteId": "GHSA-8xf4-w7qw-pjjw"
                        }
                    ]
                }
            ],
            "paths_total": 4,
            "paths": [
                {
                    "cyclic": false,
                    "chain": [
                        {
                            "package": "root",
                            "version": null,
                            "requires": "^2.7"
                        },
                        {
                            "package": "google/apiclient",
                            "version": "v2.12.1",
                            "requires": "~2.0||~3.0||~4.0||~5.0"
                        }
                    ],
                    "target": {
                        "package": "firebase/php-jwt",
                        "version": "v5.5.1"
                    }
                },
                {
                    "cyclic": false,
                    "chain": [
                        {
                            "package": "root",
                            "version": null,
                            "requires": "^5"
                        },
                        {
                            "package": "turbo124/laravel-gmail",
                            "version": "v5.0.2",
                            "requires": "^2.5"
                        },
                        {
                            "package": "google/apiclient",
                            "version": "v2.12.1",
                            "requires": "~2.0||~3.0||~4.0||~5.0"
                        }
                    ],
                    "target": {
                        "package": "firebase/php-jwt",
                        "version": "v5.5.1"
                    }
                },
                {
                    "cyclic": false,
                    "chain": [
                        {
                            "package": "root",
                            "version": null,
                            "requires": "^2.7"
                        },
                        {
                            "package": "google/apiclient",
                            "version": "v2.12.1",
                            "requires": "^1.10"
                        },
                        {
                            "package": "google/auth",
                            "version": "v1.19.0",
                            "requires": "~5.0"
                        }
                    ],
                    "target": {
                        "package": "firebase/php-jwt",
                        "version": "v5.5.1"
                    }
                },
                {
                    "cyclic": false,
                    "chain": [
                        {
                            "package": "root",
                            "version": null,
                            "requires": "^5"
                        },
                        {
                            "package": "turbo124/laravel-gmail",
                            "version": "v5.0.2",
                            "requires": "^2.5"
                        },
                        {
                            "package": "google/apiclient",
                            "version": "v2.12.1",
                            "requires": "^1.10"
                        },
                        {
                            "package": "google/auth",
                            "version": "v1.19.0",
                            "requires": "~5.0"
                        }
                    ],
                    "target": {
                        "package": "firebase/php-jwt",
                        "version": "v5.5.1"
                    }
                }
            ],
            "remediation": {
                "status": "verified",
                "command": "composer update google/apiclient:v2.12.2 -W -m --with 'firebase/php-jwt:>=6.0.0'",
                "strategy": "parent-update",
                "root_constraint_changes": [],
                "summary": {
                    "changed": 3,
                    "added": 0,
                    "removed": 0,
                    "total": 3,
                    "major_change": true,
                    "downgrade": false,
                    "prerelease": false
                },
                "changes": [
                    {
                        "package": "firebase/php-jwt",
                        "kind": "upgraded",
                        "step": "major",
                        "from": "v5.5.1",
                        "to": "v6.1.1"
                    },
                    {
                        "package": "google/apiclient",
                        "kind": "upgraded",
                        "step": "patch",
                        "from": "v2.12.1",
                        "to": "v2.12.2"
                    },
                    {
                        "package": "google/auth",
                        "kind": "upgraded",
                        "step": "minor",
                        "from": "v1.19.0",
                        "to": "v1.21.0"
                    }
                ]
            },
            "candidates": [
                {
                    "command": "composer update google/apiclient:v2.12.2 -W -m --with 'firebase/php-jwt:>=6.0.0'",
                    "strategy": "parent-update",
                    "outcome": "valid",
                    "rank": 1,
                    "summary": {
                        "changed": 3,
                        "added": 0,
                        "removed": 0,
                        "total": 3,
                        "major_change": true,
                        "downgrade": false,
                        "prerelease": false
                    },
                    "solver_status": "resolved"
                },
                {
                    "command": "composer update google/apiclient -W -m --with 'firebase/php-jwt:>=6.0.0'",
                    "strategy": "parent-update",
                    "outcome": "valid",
                    "rank": 2,
                    "summary": {
                        "changed": 3,
                        "added": 0,
                        "removed": 0,
                        "total": 3,
                        "major_change": true,
                        "downgrade": false,
                        "prerelease": false
                    },
                    "solver_status": "resolved"
                },
                {
                    "command": "composer update turbo124/laravel-gmail -W -m --with 'firebase/php-jwt:>=6.0.0'",
                    "strategy": "parent-update",
                    "outcome": "valid",
                    "rank": 3,
                    "summary": {
                        "changed": 3,
                        "added": 0,
                        "removed": 0,
                        "total": 3,
                        "major_change": true,
                        "downgrade": false,
                        "prerelease": false
                    },
                    "solver_status": "resolved"
                },
                {
                    "command": "composer update firebase/php-jwt",
                    "strategy": "lock-refresh",
                    "outcome": "rejected",
                    "reason": "resolves, but firebase/php-jwt ends at v5.5.1 which is still affected by PKSA-2kqm-ps5x-s4f5",
                    "summary": {
                        "changed": 0,
                        "added": 0,
                        "removed": 0,
                        "total": 0,